{
  "format": "jana.update.1",
  "version": "0.0.0",
  "channel": "dev",
  "os": "windows",
  "arch": "x86_64",
  "installer": {
    "name": "x",
    "size_bytes": 1,
    "sha256": "0000000000000000000000000000000000000000000000000000000000000000"
  },
  "changes": [],
  "created_at": "2026-01-15T09:30:00Z",
  "signature": {
    "alg": "ed25519",
    "key_id": "x",
    "value": "x"
  }
}
